{"status":"completed","captured_at":"2026-09-04","source_url":"https://www.metrocuadrado.com/apartamentos/arriendo/bogota/economicos/","results":[{"rank":1,"url":"https://www.metrocuadrado.com/inmueble/arriendo-apartamento-bogota-ingles-2-habitaciones-1-banos/MC6112356","rent_cop":580000,"bedrooms":2,"area_m2":55},{"rank":2,"url":"https://www.metrocuadrado.com/inmueble/arriendo-apartamento-bogota-nueva-delly-3-habitaciones-1-banos/3222-M6963978","rent_cop":700000,"bedrooms":3,"area_m2":50},{"rank":3,"url":"https://www.metrocuadrado.com/inmueble/arriendo-apartamento-bogota-2-habitaciones-1-banos/20825-M6825862","rent_cop":700000,"bedrooms":2,"area_m2":46},{"rank":4,"url":"https://www.metrocuadrado.com/inmueble/arriendo-apartamento-bogota-bosa-2-habitaciones-1-banos/3222-M6986372","rent_cop":700000,"bedrooms":2,"area_m2":45},{"rank":5,"url":"https://www.metrocuadrado.com/inmueble/arriendo-apartamento-bogota-compostela-2-habitaciones-1-banos/18552-M6884285","rent_cop":750000,"bedrooms":2,"area_m2":45},{"rank":6,"url":"https://www.metrocuadrado.com/inmueble/arriendo-apartamento-bogota-bosconia-2-habitaciones-1-banos/4058-M5793290","rent_cop":800000,"bedrooms":2,"area_m2":60},{"rank":7,"url":"https://www.metrocuadrado.com/inmueble/arriendo-apartamento-bogota-el-cortijo-2-habitaciones-1-banos/5082-M6945188","rent_cop":800000,"bedrooms":2,"area_m2":45},{"rank":8,"url":"https://www.metrocuadrado.com/inmueble/arriendo-apartamento-bogota-villa-israel-2-habitaciones-1-banos/164-M6968138","rent_cop":800000,"bedrooms":2,"area_m2":45},{"rank":9,"url":"https://www.metrocuadrado.com/inmueble/arriendo-apartamento-bogota-codito-2-habitaciones-1-banos/164-M6047256","rent_cop":830000,"bedrooms":2,"area_m2":65},{"rank":10,"url":"https://www.metrocuadrado.com/inmueble/arriendo-apartamento-bogota-bosa-2-habitaciones-1-banos/11813-M5940843","rent_cop":844000,"bedrooms":2,"area_m2":48}],"limitations":[]}